Task ID,WBS,Task Name,Phase,Start Date,End Date,Duration (Days),Duration (Weeks),Progress (%),Status,Priority,Dependencies,Resources,Deliverables,Notes,Actual Start,Actual End,Variance (Days)
P1,1,Phase 1: Research and Requirements Analysis,Phase 1,2025-03-01,2025-04-12,42,6,100,Complete,Critical,None,Student,"Literature review, Competitive analysis, Requirements spec, Use cases, Project proposal",Research foundation for entire project,2025-03-01,2025-04-12,0
P1.1,1.1,Literature Review,Phase 1,2025-03-01,2025-03-15,14,2,100,Complete,High,None,Student,"Literature review document, LMS architecture research, MVC patterns, OWASP security standards",Study of existing LMS platforms and best practices,2025-03-01,2025-03-15,0
P1.2,1.2,Competitive Analysis,Phase 1,2025-03-08,2025-03-22,14,2,100,Complete,High,P1.1,Student,"Moodle analysis, Canvas LMS evaluation, Udemy study, Google Classroom review",Analyzed features and UI/UX of major competitors,2025-03-08,2025-03-22,0
P1.3,1.3,Requirements Gathering,Phase 1,2025-03-15,2025-03-29,14,2,100,Complete,Critical,P1.2,Student,"40+ features defined, User personas (Student/Teacher/Admin), MoSCoW prioritization, Stakeholder interviews",MoSCoW: Must/Should/Could/Won't prioritization,2025-03-15,2025-03-29,0
P1.4,1.4,Use Case Development,Phase 1,2025-03-22,2025-04-12,21,3,100,Complete,High,P1.3,Student,"25+ use case diagrams, 50+ user stories, Acceptance criteria, Project proposal",Detailed use cases for all major features,2025-03-22,2025-04-12,0
P2,2,Phase 2: System Design,Phase 2,2025-04-13,2025-06-07,56,8,100,Complete,Critical,P1,Student,"MVC architecture, Database schema (21 collections), API docs (129+ endpoints), UI/UX mockups (19 pages), Integration workflows",Comprehensive system design,2025-04-13,2025-06-07,0
P2.1,2.1,Architecture Design,Phase 2,2025-04-13,2025-04-26,14,2,100,Complete,Critical,P1.4,Student,"MVC architecture diagram, Client-server design, RESTful API structure, Middleware/routing design",Foundation for all technical implementation,2025-04-13,2025-04-26,0
P2.2,2.2,Database Schema Design,Phase 2,2025-04-20,2025-05-10,21,3,100,Complete,Critical,P2.1,Student,"21 Firestore collections, User/Course/Lesson/Quiz models, Enrollment/Progress/Grade models, Order/Payment/Certificate models, Community models, Index definitions",Firebase Firestore NoSQL schema,2025-04-20,2025-05-10,0
P2.3,2.3,UI/UX Design,Phase 2,2025-05-04,2025-05-24,21,3,100,Complete,High,P2.2,Student,"19 page wireframes, Figma mockups, Color scheme (dark theme), Typography, Responsive layouts",Mobile-first design approach,2025-05-04,2025-05-24,0
P2.4,2.4,API Endpoint Design,Phase 2,2025-05-18,2025-06-07,21,3,100,Complete,Critical,P2.2,Student,"129+ API endpoints across 19 routes, API documentation, Request/response schemas, Error handling patterns",RESTful API design,2025-05-18,2025-06-07,0
P2.5,2.5,Integration Planning,Phase 2,2025-05-25,2025-06-07,14,2,100,Complete,High,P2.4,Student,"Google OAuth 2.0 design, Stripe payment flows, Cloudinary strategy, Email notification design",Third-party service integration,2025-05-25,2025-06-07,0
P3,3,Phase 3: Backend Implementation,Phase 3,2025-06-08,2025-08-23,77,11,100,Complete,Critical,P2,Student,"15 models, 19 controllers (129+ endpoints), JWT + OAuth auth, Stripe integration, Cloudinary, Puppeteer certificates, firebaseHelpers (185 lines), RBAC middleware",Complete backend development,2025-06-08,2025-08-23,0
P3.1,3.1,Development Environment Setup,Phase 3,2025-06-08,2025-06-14,7,1,100,Complete,Critical,P2.5,Student,"Node.js v14+ installation, Express.js v5.1.0, Firebase Admin SDK v13.5.0, Git repository, package.json (25+ dependencies)",Initial development setup,2025-06-08,2025-06-14,0
P3.2,3.2,Authentication System,Phase 3,2025-06-15,2025-06-28,14,2,100,Complete,Critical,P3.1,Student,"JWT authentication, Google OAuth 2.0, bcrypt hashing (10 rounds), Password reset, Session management, authController.js (4 endpoints)",Secure authentication implementation,2025-06-15,2025-06-28,0
P3.3,3.3,Core Models Development,Phase 3,2025-06-22,2025-07-12,21,3,100,Complete,Critical,P3.2,Student,"User.js with RBAC, Course.js (CRUD), Lesson.js (video/docs), Enrollment.js, Quiz.js, Question.js, firebaseHelpers.js (185 lines)",Foundation models for business logic,2025-06-22,2025-07-12,0
P3.4,3.4,Business Logic Controllers,Phase 3,2025-07-06,2025-07-26,21,3,100,Complete,Critical,P3.3,Student,"courseController.js (10 endpoints), lessonController.js (5 endpoints), quizController.js (5 endpoints), questionController.js (2 endpoints), enrollmentController.js, userController.js (8 endpoints)",Core business logic implementation,2025-07-06,2025-07-26,0
P3.5,3.5,Advanced Features,Phase 3,2025-07-20,2025-08-09,21,3,100,Complete,High,P3.4,Student,"Progress.js (lesson tracking), Grade.js (automated grading), Certificate.js (PDF generation), progressController.js (6 endpoints), gradeController.js (7 endpoints), certificateController.js (11 endpoints)",Advanced learning features,2025-07-20,2025-08-09,0
P3.6,3.6,Payment Integration,Phase 3,2025-08-03,2025-08-23,21,3,100,Complete,High,P3.5,Student,"Stripe API v18.5.0, Order.js, Payment.js, paymentController.js (7 endpoints), orderController.js (5 endpoints), Webhook handling, $9.99/month Pro tier",E-commerce functionality,2025-08-03,2025-08-23,0
P3.7,3.7,Community Features,Phase 3,2025-08-10,2025-08-23,14,2,100,Complete,Medium,P3.4,Student,"Group.js (study groups), Challenge.js (gamification), GroupMessage.js (chat), communityController.js (15 endpoints), groupController.js (8 endpoints), challengeController.js (7 endpoints)",Social learning features,2025-08-10,2025-08-23,0
P3.8,3.8,Media Upload Integration,Phase 3,2025-08-17,2025-08-23,7,1,100,Complete,High,P3.5,Student,"Cloudinary SDK, uploadController.js (3 endpoints), Image optimization, Video thumbnail generation",Media CDN integration,2025-08-17,2025-08-23,0
P4,4,Phase 4: Frontend Development,Phase 4,2025-08-24,2025-11-08,77,11,100,Complete,Critical,P3,Student,"19 responsive EJS pages, Dark mode, Mobile-first design, Spline 3D graphics, Swipe navigation, Font Awesome icons, Loading animations",Complete frontend implementation,2025-08-24,2025-11-08,0
P4.1,4.1,Landing Page & Authentication UI,Phase 4,2025-08-24,2025-09-06,14,2,100,Complete,Critical,P3.8,Student,"index.ejs with Spline 3D background, login.ejs (JWT + OAuth), signup.ejs (validation), Dark theme, Mobile responsive",Entry point and authentication,2025-08-24,2025-09-06,0
P4.2,4.2,Course Catalog & Details,Phase 4,2025-09-07,2025-09-20,14,2,100,Complete,High,P4.1,Student,"courses.ejs (filtering, search), Course detail page, Banner carousel, Swipe navigation for mobile",Course browsing functionality,2025-09-07,2025-09-20,0
P4.3,4.3,Dashboard Interfaces,Phase 4,2025-09-14,2025-10-04,21,3,100,Complete,Critical,P4.2,Student,"admin-dashboard.ejs (analytics), teacher-dashboard.ejs (course management), mylearning.ejs (student progress), Tab navigation with swipe, Progress charts",Role-based dashboards,2025-09-14,2025-10-04,0
P4.4,4.4,Lesson & Quiz Interfaces,Phase 4,2025-09-28,2025-10-18,21,3,100,Complete,Critical,P4.3,Student,"lesson-management.ejs (creation), Lesson viewer (video player), quiz.ejs (interactive taking), quiz-management.ejs (creation), Automated grading display",Learning content delivery,2025-09-28,2025-10-18,0
P4.5,4.5,Payment & E-commerce,Phase 4,2025-10-12,2025-10-25,14,2,100,Complete,High,P4.4,Student,"cart.ejs (shopping cart), payment.ejs (Stripe Checkout), success.ejs (confirmation), cancel.ejs (cancellation), order.ejs (order history)",Payment flow implementation,2025-10-12,2025-10-25,0
P4.6,4.6,Community & Profile,Phase 4,2025-10-19,2025-11-01,14,2,100,Complete,High,P4.5,Student,"community.ejs (groups, leaderboard), profile.ejs (user management), certificate.ejs (view/download), blog.ejs (educational content)",Social and profile features,2025-10-19,2025-11-01,0
P4.7,4.7,UI/UX Polish,Phase 4,2025-10-26,2025-11-08,14,2,100,Complete,Medium,P4.6,Student,"Tailwind CSS refinements, Font Awesome icons, Loading animations, Mobile responsiveness fixes, Dark mode consistency, Hide elements when not logged in",Final UI polish,2025-10-26,2025-11-08,0
P5,5,Phase 5: Testing and Quality Assurance,Phase 5,2025-10-05,2025-11-22,49,7,100,Complete,Critical,P3.4 P4.1,Student,"Jest test suite (70%+ coverage), Integration tests, Security audit (OWASP compliant), Performance tests (100+ users), Cross-browser compatibility, UAT feedback",Comprehensive testing,2025-10-05,2025-11-22,0
P5.1,5.1,Unit Testing,Phase 5,2025-10-05,2025-10-25,21,3,100,Complete,High,P3.4 P4.2,Student,"Jest framework setup, Model unit tests, Controller unit tests, Utility function tests, 70%+ code coverage",Test individual components,2025-10-05,2025-10-25,0
P5.2,5.2,Integration Testing,Phase 5,2025-10-19,2025-11-01,14,2,100,Complete,High,P5.1,Student,"Firebase emulator testing, API endpoint testing, Authentication flow testing, Payment flow testing (test mode)",Test component interactions,2025-10-19,2025-11-01,0
P5.3,5.3,Security Testing,Phase 5,2025-10-26,2025-11-08,14,2,100,Complete,Critical,P5.2,Student,"OWASP Top 10 vulnerability scan, XSS prevention verification, CSRF protection testing, Password security audit",Security compliance verification,2025-10-26,2025-11-08,0
P5.4,5.4,Performance Testing,Phase 5,2025-11-02,2025-11-15,14,2,100,Complete,High,P5.3,Student,"Load testing (100+ concurrent users), Response time optimization (<1s), Database query optimization, Image/video loading optimization",Performance benchmarking,2025-11-02,2025-11-15,0
P5.5,5.5,Cross-browser & Device Testing,Phase 5,2025-11-09,2025-11-22,14,2,100,Complete,High,P5.4,Student,"Chrome, Firefox, Safari, Edge testing, Mobile (iOS, Android), Tablet testing, Screen reader accessibility",Compatibility verification,2025-11-09,2025-11-22,0
P5.6,5.6,User Acceptance Testing,Phase 5,2025-11-16,2025-11-22,7,1,100,Complete,High,P5.5,Student,"Recruit 10+ test users, Usability sessions, Feedback gathering, Critical issue fixes",End-user validation,2025-11-16,2025-11-22,0
P6,6,Phase 6: MVC Refactoring and Optimization,Phase 6,2025-10-19,2025-11-22,35,5,100,Complete,Critical,P3 P4,Student,"firebaseHelpers.js (185 lines), 3 new models (870+ lines), 15+ enhanced model methods, Refactored 19 controllers (MVC compliant), firestore.indexes.json, 98% query reduction, 70% code duplication reduction",Architectural optimization,2025-10-19,2025-11-22,0
P6.1,6.1,Create Firebase Helpers,Phase 6,2025-10-19,2025-10-25,7,1,100,Complete,High,P3.3,Student,"firebaseHelpers.js (185 lines), getAllDocuments(), getDocumentById(), createDocument(), updateDocument(), deleteDocument(), queryDocuments(), batchOperations()",Utility functions for database operations,2025-10-19,2025-10-25,0
P6.2,6.2,Build Missing Models,Phase 6,2025-10-26,2025-11-01,7,1,100,Complete,High,P6.1,Student,"Grade.js (350+ lines, 12 methods), Certificate.js (280+ lines, 10 methods), Progress.js (240+ lines, 8 methods), Total: 870+ lines",New business logic models,2025-10-26,2025-11-01,0
P6.3,6.3,Enhance Existing Models,Phase 6,2025-10-26,2025-11-08,14,2,100,Complete,High,P6.2,Student,"User.js enhancements (5 new methods), Enrollment.js (4 new methods), Course.js (3 new methods), Lesson.js (3 new methods)",Improve existing models,2025-10-26,2025-11-08,0
P6.4,6.4,Fix N+1 Query Problems,Phase 6,2025-11-02,2025-11-08,7,1,100,Complete,Critical,P6.3,Student,"courseController.js: 201→4 queries (98% reduction), lessonController.js N+1 fixes, Batch operations implementation",Massive performance improvement,2025-11-02,2025-11-08,0
P6.5,6.5,Refactor All Controllers,Phase 6,2025-11-09,2025-11-15,7,1,100,Complete,Critical,P6.4,Student,"communityController.js (244→205 lines, 16% reduction), userController.js (111→68 lines, 39% reduction), Remove all .select() password patterns, Replace with model.getById(), 70% code duplication reduction",MVC compliance achievement,2025-11-09,2025-11-15,0
P6.6,6.6,Fix Database Issues,Phase 6,2025-11-16,2025-11-19,3,0.4,100,Complete,High,P6.5,Student,"firestore.indexes.json creation, Fix courseId/course_id inconsistencies, Resolve all Firebase index errors",Database optimization,2025-11-16,2025-11-19,0
P6.7,6.7,Final Verification,Phase 6,2025-11-20,2025-11-22,3,0.4,100,Complete,Critical,P6.6,Student,"Server startup with zero errors, 100% MVC compliance verification, Performance benchmarking, PHASE1_PROGRESS_REPORT.md, PHASE2_COMPLETION_SUMMARY.md, FINAL_REFACTORING_COMPLETION_REPORT.md, CODE_OPTIMIZATION_REPORT.md",Quality assurance,2025-11-20,2025-11-22,0
P7,7,Phase 7: Deployment and Final Documentation,Phase 7,2025-11-09,2025-11-29,21,3,85,In Progress,Critical,P5.4 P6.5,Student,"Live site (https://x.huy.global/), Academic report v5 (9 chapters), Technical documentation, API docs, Deployment guide, Presentation materials, Final submission package",Production launch and documentation,2025-11-09,2025-11-29,0
P7.1,7.1,Production Deployment,Phase 7,2025-11-09,2025-11-15,7,1,100,Complete,Critical,P5.4,Student,"Vercel account setup, Environment variables configuration, Firebase production database, Custom domain setup (x.huy.global), SSL certificate configuration, Production testing",Production environment,2025-11-09,2025-11-15,0
P7.2,7.2,Academic Report Writing,Phase 7,2025-11-16,2025-11-22,7,1,100,Complete,Critical,P6.5,Student,"Chapter 1: Introduction, Chapter 2: Literature Review, Chapter 3: Methodology, Chapter 4: System Design, Chapter 5: Implementation, Chapter 6: Testing, Chapter 7: Results, Chapter 8: Discussion, Chapter 9: Conclusion, version5.md completed (November 6)",Comprehensive academic report,2025-11-16,2025-11-22,0
P7.3,7.3,Technical Documentation,Phase 7,2025-11-23,2025-11-26,3,0.4,100,Complete,High,P7.2,Student,"API documentation, Database schema documentation, Deployment guide, User manual, Admin guide",Technical documentation,2025-11-23,2025-11-26,0
P7.4,7.4,Presentation Preparation,Phase 7,2025-11-23,2025-11-29,7,1,60,In Progress,High,P7.2,Student,"PowerPoint slides creation, Demo video recording, Q&A preparation, Practice presentation",Presentation materials,2025-11-23,2025-11-29,0
P7.5,7.5,Final Submission,Phase 7,2025-11-29,2025-11-29,1,0.1,0,Pending,Critical,P7.4,Student,"Submit academic report, Submit source code (GitHub), Submit documentation, Submit presentation materials",Final deliverable,2025-11-29,2025-11-29,0
